{
  "id": "nl-2026",
  "jurisdiction": "NL",
  "taxYear": 2026,
  "packVersion": "1.0.0",
  "dslVersion": "1.0",
  "tables": "nl-2026",
  "currency": "EUR",
  "grossRef": "@binding.tvl",
  "basedOn": [
    {
      "doc": "Belastingdienst — Rekenvoorschriften voor de geautomatiseerde loonadministratie 2026 (RV2026), sec. 2.1-2.2.4",
      "url": "https://www.belastingdienst.nl/wps/wcm/connect/nl/aangifte-loonheffingen/content/rekenvoorschriften"
    },
    {
      "doc": "Belastingdienst — Rekenregels en premiepercentages 2026 (RPP2026)",
      "url": "https://www.belastingdienst.nl/wps/wcm/connect/nl/aangifte-loonheffingen/content/rekenregels-premiepercentages"
    }
  ],
  "_notes": {
    "parameters": "Every rate, bracket and threshold arrives by @table.* reference into the verified lib/Standards/tables/nl-2026.json corpus. NO parameter value is copied into this pack: the {value, source, verified} leaves keep exactly one home (design.md D4).",
    "units": "The corpus carries no unit marker on its leaves (Lv: 54 is euro, zvw.werkgeversheffing: 6.1 is a percentage), so this pack DECLARES the unit via the :cents ref suffix and the bracket op's `unit` field. Unit knowledge lives here, in config — never in the interpreter.",
    "hatch": "Zero phpStep uses. Every step of the NL chain is expressible in the declarative vocabulary.",
    "netto": "There is deliberately NO netto step. Net is the interpreter's fold over incidence: gross - sum(reduces-net). For NL that yields tvl - loonheffing because every employer charge below honestly declares employer-cost — not because any rule says so.",
    "gaps": "Reproduces the engine at HEAD, gaps included: no VCR (every premium is period-capped, not cumulative-year-capped) and no above-Lmax 'systematiek 1' (the aboveLmax binding flags it; the chain does not extend)."
  },
  "inputs": {
    "gross": {
      "type": "cents",
      "required": true
    },
    "taxTableColor": {
      "type": "enum",
      "values": ["wit", "groen"],
      "default": "wit"
    },
    "loonheffingskortingToegepast": {
      "type": "boolean",
      "default": true
    },
    "dateOfBirth": {
      "type": "date",
      "nullable": true,
      "default": null
    },
    "awfTariff": {
      "type": "enum",
      "values": ["laag", "hoog"],
      "default": "laag"
    },
    "aofTariff": {
      "type": "enum",
      "values": ["laag", "hoog"],
      "default": "laag"
    },
    "whkPercentage": {
      "type": "percent",
      "default": 0
    },
    "verzekeringsplichtig": {
      "type": "boolean",
      "default": true
    }
  },
  "bindings": [
    {
      "id": "tvl",
      "_note": "The taxable wage for the period. HEAD: max(0, grossMonthlySalaryCents).",
      "op": "derive",
      "using": {
        "op": "clamp",
        "value": "@input.gross",
        "min": 0
      }
    },
    {
      "id": "aow",
      "_note": "AOW-age applies from the FIRST DAY OF THE MONTH in which the employee reaches the statutory AOW-leeftijd (RV2026 tabel 3 toelichting). An absent/unparseable date of birth yields false — the conservative default, as at HEAD.",
      "op": "derive",
      "using": {
        "op": "ageReached",
        "dob": "@input.dateOfBirth",
        "years": "@table.aow.leeftijdJaren",
        "asOf": "@period.lastDay",
        "granularity": "month"
      }
    },
    {
      "id": "wit",
      "_note": "The groene tabel runs the identical chain with arbeidskorting skipped (RV2026 sec. 2.2.3.4).",
      "op": "derive",
      "using": {
        "op": "ne",
        "left": "@input.taxTableColor",
        "right": "groen"
      }
    },
    {
      "id": "birthYear",
      "op": "derive",
      "using": {
        "op": "yearOf",
        "value": "@input.dateOfBirth",
        "default": 1946
      }
    },
    {
      "id": "bornBefore1946",
      "op": "derive",
      "using": {
        "op": "lte",
        "left": "@binding.birthYear",
        "right": 1945
      }
    },
    {
      "id": "aowSchijvenSet",
      "op": "derive",
      "using": {
        "op": "match",
        "on": "@binding.bornBefore1946",
        "cases": {
          "true": "aowBorn1945OrEarlier",
          "false": "aowBorn1946OrLater"
        }
      }
    },
    {
      "id": "schijvenSet",
      "_note": "HEAD's schijvenSet() PHP branch, as a data lookup.",
      "op": "derive",
      "using": {
        "op": "match",
        "on": "@binding.aow",
        "cases": {
          "true": "@binding.aowSchijvenSet",
          "false": "belowAow"
        }
      }
    },
    {
      "id": "kortingCol",
      "_note": "The AHK/ARK korting column: a table-set selection, not a branch.",
      "op": "derive",
      "using": {
        "op": "match",
        "on": "@binding.aow",
        "cases": {
          "true": "aowAge",
          "false": "belowAow"
        }
      }
    },
    {
      "id": "annualised",
      "_note": "tvl x F (the tijdvakfactor for a monthly period).",
      "op": "derive",
      "using": {
        "op": "expr",
        "expression": "@binding.tvl * @table.loonheffing.tijdvakFactoren.maand"
      }
    },
    {
      "id": "aboveLmax",
      "_note": "Documented edge: the engine flags it but does not implement the above-Lmax 'systematiek 1' linear extension.",
      "op": "derive",
      "using": {
        "op": "gt",
        "left": "@binding.annualised",
        "right": "@table.loonheffing.Lmax:cents"
      }
    },
    {
      "id": "L",
      "_note": "Tabelloon L = floor(annualised / Lv) x Lv. Lv is a whole-euro multiple, so L is automatically a whole-euro amount.",
      "op": "derive",
      "using": {
        "op": "quantize",
        "value": "@binding.annualised",
        "step": "@table.loonheffing.Lv:cents",
        "mode": "floor"
      }
    },
    {
      "id": "schijf1Top",
      "_note": "The top of the first bracket, over which the informative volksverzekeringen split is computed.",
      "op": "derive",
      "using": {
        "op": "expr",
        "expression": "@table.loonheffing.schijven[@binding.schijvenSet][0].tot:cents"
      }
    },
    {
      "id": "vvRateBelowAow",
      "op": "derive",
      "using": {
        "op": "expr",
        "expression": "@table.volksverzekeringen.aow + @table.volksverzekeringen.anw + @table.volksverzekeringen.wlz"
      }
    },
    {
      "id": "vvRateAow",
      "_note": "At AOW-age the AOW premium is no longer levied.",
      "op": "derive",
      "using": {
        "op": "expr",
        "expression": "@table.volksverzekeringen.anw + @table.volksverzekeringen.wlz"
      }
    },
    {
      "id": "vvRate",
      "op": "derive",
      "using": {
        "op": "match",
        "on": "@binding.aow",
        "cases": {
          "true": "@binding.vvRateAow",
          "false": "@binding.vvRateBelowAow"
        }
      }
    },
    {
      "id": "vvJaar",
      "op": "derive",
      "using": {
        "op": "expr",
        "expression": "min(@binding.L, @binding.schijf1Top) * (@binding.vvRate / 100)"
      }
    },
    {
      "id": "vakantiegeldRate",
      "op": "derive",
      "using": {
        "op": "expr",
        "expression": "@table.vakantiebijslag.minRatePercent"
      }
    },
    {
      "id": "zvwRate",
      "op": "derive",
      "using": {
        "op": "expr",
        "expression": "@table.zvw.werkgeversheffing"
      }
    },
    {
      "id": "premieloonCap",
      "_note": "The monthly maximum premieloon — the same leaf caps the Zvw bijdrageloon, since both share one annual maximum in the corpus.",
      "op": "derive",
      "using": {
        "op": "expr",
        "expression": "@table.werknemersverzekeringen.maximumpremieloon.maand:cents"
      }
    },
    {
      "id": "awfRate",
      "op": "derive",
      "using": {
        "op": "match",
        "on": "@input.awfTariff",
        "cases": {
          "laag": "@table.werknemersverzekeringen.awf.laag",
          "hoog": "@table.werknemersverzekeringen.awf.hoog"
        }
      }
    },
    {
      "id": "aofRate",
      "op": "derive",
      "using": {
        "op": "match",
        "on": "@input.aofTariff",
        "cases": {
          "laag": "@table.werknemersverzekeringen.aof.laag",
          "hoog": "@table.werknemersverzekeringen.aof.hoog"
        }
      }
    }
  ],
  "steps": [
    {
      "id": "vakantiegeld",
      "_note": "Vakantiegeldreservering — 8% of the gross wage. RESERVE: neither cash to the employee this period nor an employer charge this period. Folding it into either would misstate one of them.",
      "op": "rate",
      "incidence": "reserve",
      "base": "@binding.tvl",
      "rate": "@binding.vakantiegeldRate",
      "round": {
        "mode": "nearest",
        "unit": "cent"
      }
    },
    {
      "id": "x1",
      "_note": "Schijventarief X1 = floorEuro((L - a) x percentage/100 + c).",
      "op": "bracket",
      "incidence": "informative",
      "value": "@binding.L",
      "table": "@table.loonheffing.schijven[@binding.schijvenSet]",
      "unit": "euro",
      "mode": "affine",
      "round": {
        "mode": "floor",
        "unit": "euro"
      }
    },
    {
      "id": "ahk",
      "_note": "Algemene heffingskorting — a phase-out above ahkg1, floored at 0, ceil-to-whole-euro.",
      "op": "taper",
      "incidence": "informative",
      "when": "@input.loonheffingskortingToegepast",
      "base": "@table.heffingskortingen.ahkm1[@binding.kortingCol]:cents",
      "value": "@binding.L",
      "threshold": "@table.heffingskortingen.ahkg1[@binding.kortingCol]:cents",
      "rate": "@table.heffingskortingen.ahka1[@binding.kortingCol]",
      "floor": 0,
      "round": {
        "mode": "ceil",
        "unit": "euro"
      }
    },
    {
      "id": "ark",